"intent_id","response"
f7716d57-1666-423a-be1d-7be24010889b,สวัสดีค่ะ วันนี้ต้องการใช้ช่วยเหลือด้านใดค่ะ
f7716d57-1666-423a-be1d-7be24010889b,สวัสดีครับ วันนี้ต้องการใช้บริการด้านไหนครับ
4fa6ed26-eef8-46b4-b7df-23ec0becf933,สิทธิบัตร หมายถึง หนังสือสำคัญที่รัฐออกให้เพื่อคุ้มครองการประดิษฐ์หรือการออกแบบผลิตภัณฑ์ที่มีลักษณะตามที่กฎหมายกำหนด เป็นสิทธิพิเศษที่ให้ผู้ประดิษฐ์คิดค้นหรือผู้ออกแบบผลิตภัณฑ์ มีสิทธิที่จะผลิตสินค้าจำหน่ายสินค้าแต่เพียงผู้เดียวในช่วงระยะเวลาหนึ่ง
4fa6ed26-eef8-46b4-b7df-23ec0becf933,การประดิษฐ์ หมายถึง ความคิดสร้างสรรค์เกี่ยวกับลักษณะองค์ประกอบโครงสร้างหรือกลไกของผลิตภัณฑ์ รวมทั้งกรรมวิธีในการผลิตการรักษาหรือปรับปรุงคุณภาพของผลิตภัณฑ์ให้ดีขึ้นหรือทำให้เกิดผลิตภัณฑ์ขึ้นใหม่ที่แตกต่างไปจากเดิมและเน้นการประดิษฐ์ที่มีลักษณะของการแก้ไขปัญหาทางเทศนิคที่ไม่สามารถคิดคันขึ้นโดยง่าย เช่น กลไกของเครื่องยนต์ ยารักษาโรค วิธีการในการเก็บรักษาพืชผักผลไม้ไม่ให้เน่าเสียเร็วเกินไป เป็นต้น
42fddf8b-9c83-4489-a4c8-586addeb4498,อนุสิทธิบัตร (Petty Patent) หมายถึงหนังสือสำคัญที่รัฐออกให้เพื่อคุ้มครองการประดิษฐ์จะมีลักษณะคล้ายกันกับการประดิษฐ์ แต่เป็นความคิดสร้างสรรค์ที่มีระดับการพัฒนาเทคโนโลยีไม่สูงมาก หรือเป็นการประดิษฐ์คิดค้นเพียงเล็กน้อย
9b7420e9-678d-46e8-98cc-5d106b61e71f,(เหมือนกัน) ในแง่ของการคุ้มครองลักษณะองค์ประกอบ คุ้มครองรูปร่างหรือรูปทรง โครงสร้างหรือกลไกของ ผลิตภัณฑ์รวมทั้งกรรมวิธี ภายนอกของผลิตภัณฑ์รวมถึงในการผลิตการรักษาหรือปรับปรุงคุณภาพของผลิตภัณฑ์ให้ดีขึ้น ลวดลายหรือสีของผลิตภัณฑ์ การออกแบบผลิตภัณฑ์